{
  "$schema": "http://json-schema.org/draft-07/schema#",
  "$id": "dd-flow/compatibility-contexts@1",
  "title": "dd-flow compatibility contexts",
  "description": "Observable project-current, upgrade-target and effective-execution contexts used by mb-upgrade routing.",
  "type": "object",
  "additionalProperties": false,
  "required": ["schema_id", "project_current", "upgrade_target", "effective_execution"],
  "properties": {
    "schema_id": { "const": "dd-flow/compatibility-contexts@1" },
    "project_current": { "$ref": "#/definitions/projectCurrentContext" },
    "upgrade_target": {
      "anyOf": [
        { "type": "null" },
        { "$ref": "#/definitions/upgradeTargetContext" }
      ]
    },
    "effective_execution": { "$ref": "#/definitions/effectiveExecutionContext" }
  },
  "definitions": {
    "projectCurrentContext": {
      "type": "object",
      "additionalProperties": true,
      "required": ["name", "canon", "memory_bank_version", "package_name", "required_engine_range", "resolution", "engine_version", "diagnostics"],
      "properties": {
        "name": { "const": "project_current" },
        "canon": { "type": "object", "additionalProperties": true },
        "memory_bank_version": { "type": ["string", "null"] },
        "package_name": { "type": "string", "minLength": 1 },
        "required_engine_range": { "type": ["string", "null"] },
        "recommended_engine_version": { "type": ["string", "null"] },
        "resolution": { "type": "string", "minLength": 1 },
        "engine_version": { "type": ["string", "null"] },
        "diagnostics": { "type": "array", "items": { "type": "string" } }
      }
    },
    "upgradeTargetContext": {
      "type": "object",
      "additionalProperties": true,
      "required": ["name", "canon", "memory_bank_version", "package_name", "required_engine_range", "resolution", "engine_version", "diagnostics"],
      "properties": {
        "name": { "const": "upgrade_target" },
        "canon": {
          "type": "object",
          "additionalProperties": true,
          "required": ["root", "version", "commit", "compatibility_sha256"],
          "properties": {
            "root": { "type": "string", "minLength": 1 },
            "version": { "type": "string", "minLength": 1 },
            "commit": { "type": "string", "minLength": 1 },
            "compatibility_sha256": { "type": "string", "pattern": "^[a-f0-9]{64}$" }
          }
        },
        "memory_bank_version": { "type": ["string", "null"] },
        "package_name": { "type": "string", "minLength": 1 },
        "required_engine_range": { "type": ["string", "null"] },
        "recommended_engine_version": { "type": ["string", "null"] },
        "resolution": { "type": "string", "minLength": 1 },
        "engine_version": { "type": ["string", "null"] },
        "diagnostics": { "type": "array", "items": { "type": "string" } }
      }
    },
    "effectiveExecutionContext": {
      "type": "object",
      "additionalProperties": false,
      "required": ["operation", "mode", "package_name", "engine_version", "reason"],
      "properties": {
        "operation": { "type": "string", "minLength": 1 },
        "mode": { "type": "string", "minLength": 1 },
        "package_name": { "type": "string", "minLength": 1 },
        "engine_version": { "type": ["string", "null"] },
        "reason": { "type": "string", "minLength": 1 }
      }
    }
  }
}
